"Link","Type","Title","Description","By","Country","Rating","Categories","Colors"
"https://www.awwwards.com/sites/this-is-teixido","Month","This is Teixido","This is Teixido a branding, web/interface design studio that blah blah blah. In all seriousness, we can pretty much write whatever we want here and chances are, nobody will notice. The itsy bitsy spider went up the water spout. Down came the rain, and washed the spider out. See what we mean? Scroll down and find out why this happens...","Teixido","Paraguay",8.04,"Design Agencies,Web & Interactive","Silver,Yellow"
"https://www.awwwards.com/sites/image-mechanics","Month","Image Mechanics","Formed in New Zealand in 2004, Image Mechanics has gone from strength to strength since opening our Sydney studio, continuing to deliver premium branding, design and digital services.","Image Mechanics","Australia",7.9,"Design Agencies,Other","Black,Red,White"
"https://www.awwwards.com/sites/donq","Month","DonQ","Our company legacy is a living force that drives our constant quest to perfect the art of distillation. It is the collective wisdom passed down through six generations of the Serrallés family in over 145 years of crafting rum.","Odopod ","United States",7.2,"Business & Corporate,Games & Entertainment,Other","Black"
"https://www.awwwards.com/sites/treme","Month","Treme","Promotion website of HBO serie Treme for France[gallery]","ultranoir","France",7.64,"Film & TV","Blue,Brown,Green,Orange"
"https://www.awwwards.com/sites/wing-cheng","Month","Wing Cheng","","Wing Cheng","Netherlands",7.42,"Web & Interactive","White"
"https://www.awwwards.com/sites/dribbble-interactive-infographic","Month","Dribbble Interactive Infographic","","Jamie Brightmore ","United Kingdom",7.18,"Art & Illustration,Other,CSS3,HTML5","Pink,Silver"
"https://www.awwwards.com/sites/cafundo-estudio","Month","Blog Cafundó Estúdio","Cafundó is a digital design studio focused on motion graphics, animation, illustration and innovative media solutions. We hope to enlarge our network and meet creative people.","Guilherme Simoes","Brazil",7.4,"Magazine / Newspaper / Blog","Black,Silver"
"https://www.awwwards.com/sites/hyperakt","Month","Hyperakt","Hyperakt is an independent New York City design firm with a passion for creating work that effects change in the world around us.","Hyperakt ","United States",7.49,"Web & Interactive,Clean,Graphic design,Portfolio,jQuery","Orange,White"
"https://www.awwwards.com/sites/carbonmade","Month","Carbonmade","Carbonmade is an online portfolio service that helps you show off your work.","Carbonmade ","United States",7.28,"Business & Corporate,Other","Blue,Green,Pink"
"https://www.awwwards.com/sites/oliver-james","Month","Oliver James","web design","Lick","Studio",7.47,"Web & Interactive","Blue,Silver,White"
"https://www.awwwards.com/sites/duplos","Month","Duplos","Ricardo Mestre's Web Thingie","Ricardo Mestre","Portugal",6.81,"Web & Interactive,Animation,Texture,jQuery","Blue,Brown,Green,Orange"
"https://www.awwwards.com/sites/giraffe","Month","Giraffe","Giraffe Restaurants are a friendly and welcoming family restaurant with a world music feel and international dishes.","Engage Interactive ","United Kingdom",7.62,"Hotel / Restaurant","Brown,Green,Yellow"
"https://www.awwwards.com/sites/branded07","Month","Branded07","Online Web Design Portfolio of Rob Palmer","Rob Palmer / Branded07 ","United Kingdom",7.84,"Magazine / Newspaper / Blog,Portfolio","Black,Blue,White"
"https://www.awwwards.com/sites/the-pixel","Month","The Pixel","The Pixel provides the most ingenious design and marketing solutions on the web. And with a track record of absolute excellence, you’re in good hands.","The Pixel ","United Kingdom",7.88,"Magazine / Newspaper / Blog","Blue"
"https://www.awwwards.com/sites/world-of-merix","Month","World of Merix","Javascript driven microsite showcasing Merix Studio skills and clients.[gallery]","Merix Studio","Poland",7.85,"Games & Entertainment,Other,Portfolio,jQuery","Black,Green,Orange"
