"Link","Type","Title","Description","By","Country","Rating","Categories","Colors"
"https://www.awwwards.com/sites/miranda-paper-portfolio","Month","Miranda – Paper Portfolio","Amsterdam-based independent Designer & Developer with focus on Art Direction, Motion Design and Creative Development.","Niccolò Miranda","Netherlands",7.92,"Design Agencies,Web & Interactive,Navigation Menu,Portfolio,Typography,Illustration,Copy design,Project Page,WebGL,GSAP Animation,Three.js,Webflow","Black,Brown"
"https://www.awwwards.com/sites/the-shift-1","Month","The Shift","The Shift was created for things and people desiring a shift - a movement, a change - in business, organization, space, product, or service.","Garden Eight","Japan",7.66,"Business & Corporate,Animation,Clean,WebGL,GSAP Animation,BARBA.js","Black,Red,White"
"https://www.awwwards.com/sites/grids","Month","Grids","The educational project about grids which Obys uses every day with unusual storytelling.","Os agency","Ukraine",7.83,"Culture & Education,Web & Interactive,Experimental,Animation,Horizontal Layout,Minimal,Scrolling,Storytelling,Interaction Design,SVG,Figma,ReadyMag","Black,White,Yellow"
"https://www.awwwards.com/sites/2021-virtual-webbys","Month","2021 Virtual Webbys","Our virtual platform allowed viewers of the 2021 Webby Awards to watch the full show or cherry-pick individual elements, in an appropriately digital ode to the best of the internet.","MediaMonks","Netherlands",7.81,"Events,Web & Interactive,Colorful,Graphic design,Video,Filters and Effects,WebGL,PHP,Vue.js","Blue,Red,Yellow"
"https://www.awwwards.com/sites/the-harmonic-state","Month","The Harmonic State","Explore three webgl levels and learn how IBM transforms business operations from dissonance to harmony through Watson’s critical insights.","Active Theory ","United States",7.98,"Games & Entertainment,Clean,Sound-Audio,Storytelling,Filters and Effects,Interaction Design,WebGL","Blue,Green,White"
"https://www.awwwards.com/sites/aristide-portfolio-2021","Month","Aristide – Portfolio 2021","Portfolio of Aristide Benoist, freelance developer. Design by Jon Way, development and motion by Aristide Benoist.","Aristide Benoist ","United States",8.01,"Promotional,Web & Interactive,Experimental,Graphic design,Portfolio,Interaction Design,WebGL,GLSL,Javascript","Black,White"
"https://www.awwwards.com/sites/prometheus-fuels","Month","Prometheus Fuels","Dive into this stylized interactive story and learn how Prometheus Fuels is creating fuel from the air.","Active Theory ","United States",8.4,"Business & Corporate,Technology,Web & Interactive,Animation,Clean,Colorful,Fullscreen,Storytelling,Filters and Effects,WebGL","Blue,Red,White"
"https://www.awwwards.com/sites/superlist","Month","Superlist","Superlist is building the productivity tool of the future; for teams and individuals alike.","GC ","United Kingdom",7.84,"Mobile & Apps,Technology,Startups,Animation,Clean,Illustration,3D,Microinteractions,Three.js","Black,Red,White"
"https://www.awwwards.com/sites/into-the-storm","Month","Into the Storm","Into the Storm is an interactive documentary that charts a real pararescue mission through sweeping CGI and an immersive soundscape. Join the rescue as if you were there.","MediaMonks","Netherlands",8.15,"Institutions,Promotional,Web & Interactive,Animation,Scrolling,Storytelling,3D,Interaction Design,Microinteractions,HTML5,WebGL,GSAP Animation,Vue.js","Blue,Silver,White"
"https://www.awwwards.com/sites/umami-land","Month","Umami Land","Discover Japanese cuisine on a virtual food trip. This WebGL experience teaches about a variety of trademark dishes so you know what’s good when it’s safe to go out again.","MediaMonks","Singapore",8.23,"Art & Illustration,Culture & Education,Food & Drink,Animation,App Style,Illustration,360,3D,Interaction Design,WebGL","Blue,Green,Yellow"
"https://www.awwwards.com/sites/sea-shepherd-no-fishing-net","Month","Sea Shepherd - No fishing net","Sea Shepherd launch no-fishing.net, a rallying cry to save marine wildlife from extinction by deadly fishing nets. If the ocean dies, we die.","makemepulse","France",7.96,"Institutions,Social responsibility,Animation,3D,WebGL","Black"
"https://www.awwwards.com/sites/medal-of-honor-above-beyond","Month","Medal of Honor: Above & Beyond","This immersive site for Respawn Entertainment’s Medal of Honor brings the 3D feeling of Oculus VR gaming to 2D surfaces. Step into the shoes of a WWII OSS agent, in 360º reality.","Oculus Electronic Arts & Jam3","Canada",7.84,"Games & Entertainment,Technology,Web & Interactive,Animation,Parallax,Video,360,Storytelling,3D,CSS3,WebGL,GSAP Animation,Three.js,React,YouTube API","Brown,Silver,Yellow"
"https://www.awwwards.com/sites/kode","Month","Kode Sports Club","KODE is a multi-disciplinary sports club opening in Q2 2022 in New Cairo. KODE has an holistic program for every aspect of an athlete’s development.","Merci-Michel","France",8.3,"Sports,Animation,Fullscreen,3D,Three.js","Blue,Green,Pink"
"https://www.awwwards.com/sites/chile20","Month","CHILE20","We worked with adidas Originals to create and showcase realistic 3D products for the new CHILE20 collection.","Active Theory","Netherlands",7.96,"Fashion,Promotional,Sports,Horizontal Layout,Minimal,Transitions,Storytelling,3D,WebGL","Black,Red,White"
"https://www.awwwards.com/sites/2degc-earth","Month","2°C EARTH","A visual guide exploring the ramifications of our increasingly warmer planet through five locations around the world whose natural and cultural heritage is threatened by climate change.","Jingqi Fan ","United States",7.92,"Culture & Education,Music & Sound,Web & Interactive,Clean,Parallax,Typography,Sound-Audio,Storytelling,Photo & Video,GSAP Animation,Nuxt.js","Black,White"
"https://www.awwwards.com/sites/ali-ali","Month","Ali Ali","Ali Ali is a commercials director from Cairo—Egypt and the founder of Good People.","Exo Ape","Netherlands",7.73,"Film & TV,Clean,Minimal,Portfolio,Typography,Video,About Page,Wordpress,CSS3,HTML5,GSAP Animation,Webpack","Black,White"
"https://www.awwwards.com/sites/pioneer-corn-revolutionized","Month","Pioneer - Corn Revolutionized","The behind the scenes process and cutting edge science of Pioneer corn told through the choreography of realtime 3D assets and animation.","Resn","Netherlands",8.18,"Business & Corporate,Web & Interactive,Scrolling,3D","Black"
"https://www.awwwards.com/sites/delassus","Month","Delassus","Delassus Group is a moroccan company specialised in the production of tomatoes, lemons, grapes, avocados and also flowers.","BONHOMME","France",7.72,"Food & Drink,Web & Interactive,Colorful,Fullscreen,Parallax,CSS3,HTML5","Green,Orange,Yellow"
"https://www.awwwards.com/sites/alan-menken","Month","Alan Menken","Legendary composer Alan Menken has created some of the most beloved songs & musical scores of our time, capturing the imagination of audiences for over 35 years.","Hello Monday ","United States",8.04,"Film & TV,Music & Sound,Animation,Portfolio,Typography,Transitions,Storytelling,Microinteractions","Black,Brown,White"
"https://www.awwwards.com/sites/powerhouse-company","Month","Powerhouse Company","We helped Powerhouse Company with a complete rebranding, from brand positioning to brand identity to platform.","Build in Amsterdam","Netherlands",7.95,"Architecture,Animation,Flat Design,Fullscreen,Gallery,UI design,Microinteractions,Wordpress,WebGL,Three.js,React","Black,Blue,White"
"https://www.awwwards.com/sites/madeleine-dalla","Month","Madeleine Dalla","Madeleine Dalla is a New York based photographer. We built a visual identity and framed her incredible work in an elegant new portfolio website.","MarvinSchwaibold ","United States",7.9,"Web & Interactive,Photography,Experimental,Animation,Portfolio,Typography,Gallery,Interaction Design,Nuxt.js","Blue,Orange,White"
"https://www.awwwards.com/sites/the-year-of-greta","Month","The Year of Greta","A passion project illustrating the timeline of Greta Thunberg's rise from solo campaigner to the leader of a global movement in 2019.","Superhero Cheesecake","Netherlands",7.77,"Culture & Education,Design Agencies,Web & Interactive,Single page,Unusual Navigation,Data Visualization,Storytelling,Gestures / Interaction,Interaction Design,GSAP Animation,Three.js,Backbone.js","Green,Silver,White"
"https://www.awwwards.com/sites/apple-airpods-pro","Month","Apple AirPods Pro","Continuous movements within a fixed-frame view, activated on scroll, and copy that strikes a powerful yet magical tone combine to mirror the fluid listening experience of AirPods Pro.","Apple ","United States",7.93,"Mobile & Apps,Technology,Web & Interactive,Animation,Graphic design,Scrolling,Single page,Interaction Design,Photo & Video,CSS3,HTML5,WebGL,GLSL","Black,Silver,White"
"https://www.awwwards.com/sites/canals","Month","CANALS","CANALS is a personal passion project, celebrating the history and creation of the iconic Amsterdam canals through an editorial style, visual design piece.","Marcus Brown","Netherlands",8.28,"Magazine / Newspaper / Blog,Culture & Education,Web & Interactive,Colorful,Fullscreen,Graphic design,Horizontal Layout,Infinite Scroll,Parallax","Black,Red,White"
"https://www.awwwards.com/sites/bruno-simon-portfolio","Month","Bruno Simon Portfolio","Creative developer // Lead developer at Immersive Garden // Teacher at HETIC // Freelancer // WebGL lover","Bruno Simon","France",8.04,"Games & Entertainment,Web & Interactive,Animation,3D,Gestures / Interaction,Three.js","Orange,Yellow"
"https://www.awwwards.com/sites/editorial-new","Month","Editorial New","Editorial New is a precise and elegant narrow serif typeface that was designed for the long-form copy with a big enough personality to make a statement as a title.","Locomotive","Canada",7.85,"Art & Illustration,Promotional,Web & Interactive,Clean,Parallax,Retro,Typography,Microinteractions,CSS3,HTML5,GSAP (Greensock),PHP,CloudFlare","Black,White"
"https://www.awwwards.com/sites/ma","Month","MA","MA: discover our 4 Worlds and get inspired.","Retail 710","Switzerland",7.9,"E-Commerce,Web & Interactive,Animation,Responsive,3D,Microinteractions,CSS3,HTML5,Three.js,React,GLSL,IIS","Blue,Red,Yellow"
"https://www.awwwards.com/sites/once-upon-a-time-in-hollywood","Month","Once Upon a Time in Hollywood","A web and print experience structured in the style of a 1969 lifestyle magazine. Fans were able to dig deeper into Taratino's world.","Watson Design Group Inc. ","United States",8.06,"Film & TV,Mobile & Apps,Promotional,Graphic design,Copy design,HTML5,jQuery,WebGL,PHP,Three.js","Black,Orange,Silver"
"https://www.awwwards.com/sites/the-frontier-within","Month","The Frontier Within","The Frontier Within is a web experience that transforms the circulatory, respiratory, and nervous systems into an interactive portrait of the human body.","Active Theory ","United States",7.88,"Art & Illustration,Web & Interactive,Experimental,Fullscreen,Transitions,Storytelling,WebGL,GLSL","Black,Blue,Red"
"https://www.awwwards.com/sites/locomotive-1","Month","Locomotive","Locomotive has become a leader in digital experiences, web design and branding. That’s not a brag, it’s a promise: to deliver tomorrow’s creative solutions — today.","Locomotive","Canada",8.22,"Business & Corporate,Design Agencies,Web & Interactive,Animation,Parallax,Portfolio,Transitions,Gestures / Interaction,Interaction Design,CSS3,HTML5,WebGL,GSAP (Greensock),CloudFlare,PixiJS","Black,Blue,White"
"https://www.awwwards.com/sites/lusion","Month","Lusion","Lusion is a real-time, development focussed, creative studio. We collaborate with creative agencies and design studios to deliver compelling, real-time experiences.","Lusion ","United Kingdom",7.96,"Art & Illustration,Design Agencies,Web & Interactive,Animation,Portfolio,3D,WebGL,Three.js","Black,White"
"https://www.awwwards.com/sites/dogstudio-1","Month","Dogstudio","Dogstudio is a multidisciplinary creative studio at the intersection of art, design and technology.","Dogstudio ","United States",8.17,"Design Agencies,Animation,Parallax,Transitions,3D,Wordpress,WebGL,Three.js","Black,Red,White"
"https://www.awwwards.com/sites/2018-year-in-review","Month","2018: Year in Review","With the hours, days and months flying by at lightning speed, we take a moment to dive into our 2018 time capsule and reflect on the year gone by.","Green Chameleon ","United Kingdom",7.84,"Design Agencies,Web & Interactive,Experimental,Clean,Colorful,Parallax,Gallery,3D,Microinteractions,WebGL,Three.js","Blue,Green,Yellow"
"https://www.awwwards.com/sites/nomadic-tribe","Month","Nomadic Tribe","It’s time for the big journey! Experience Nomadic Tribe, our interactive tale for this new year. May it bring us many exciting surprises. Happy 2019 from makemepulse.","makemepulse","France",8.3,"Art & Illustration,Web & Interactive,Experimental,Animation,Colorful,Unusual Navigation,Illustration,Storytelling,3D,WebGL","Brown,Green,Yellow"
"https://www.awwwards.com/sites/everest","Month","Everest","Everest is a digital agency that builds products and brands that people love.","Everest ","United States",7.57,"Business & Corporate,Design Agencies,Minimal,Transitions,3D,Gestures / Interaction,Microinteractions,404 pages,WebGL,Apache,PHP","Black,Silver,White"
"https://www.awwwards.com/sites/twenty-one-pilots-bandito","Month","twenty øne piløts - Banditø","Bandito is the immersive experience from twenty øne piløts in collaboration with Spotify. Journey through 5 locations, escape from Dema and uncover the hidden meanings of Trench.","Resn","Netherlands",7.86,"Music & Sound,Web & Interactive,Animation,Fullscreen,Transitions,Storytelling,3D,Filters and Effects,HTML5,WebGL,GSAP Animation,Three.js","Black,Yellow"
"https://www.awwwards.com/sites/orano","Month","Orano","Learn more about Orano's approach to nuclear interventions.","Immersive Garden","France",8.02,"Business & Corporate,Web & Interactive,Experimental,Parallax,Unusual Navigation,Transitions,Storytelling,3D,UI design,Three.js","Black,White,Yellow"
"https://www.awwwards.com/sites/google-cloud-infrastructure","Month","Google Cloud Infrastructure","A new experience site that showcases the sophistication, scale and power of Google’s global infrastructure through use of case studies that explain complex processes.","Hello Monday ","United States",7.87,"Business & Corporate,Technology,Web & Interactive,Storytelling,3D,UI design,WebGL,GSAP (Greensock)","Black,Blue,White"
"https://www.awwwards.com/sites/robin-mastromarino-portfolio-1","Month","Robin Mastromarino - Portfolio","Portfolio of Robin Mastromarino, interactive designer who lives in Paris.","Mastromarino","France",7.85,"Design Agencies,Web & Interactive,Animation,Big Background Images,Clean,Portfolio,Scrolling,Gestures / Interaction,WebGL,Three.js","Black,White"
"https://www.awwwards.com/sites/beyond-beauty","Month","Beyond Beauty","Four women primarily known for their appearance. Discover their true inner beauty","Louis Ansa","France",7.94,"Art & Illustration,Culture & Education,Animation,Graphic design,Illustration,Transitions,Sound-Audio,Storytelling,GSAP (Greensock),PixiJS","Black,Pink,White"
"https://www.awwwards.com/sites/foosball-world-cup-18","Month","Foosball World Cup 18","The 2018 Foosball World Cup is an interactive game, created to celebrate the FIFA World Cup and all the foosball lovers.","AQuest","Italy",7.81,"Games & Entertainment,Sports,Experimental,Colorful,Graphic design,3D,SVG,WebGL,Three.js,GLSL","Black,Red,White"
"https://www.awwwards.com/sites/oat-the-goat","Month","Oat the Goat","'Oat the Goat' is an interactive, WebGL, animated storybook launched as a bullying prevention initiative by New Zealand's Ministry of Education.","Assembly ","New Zealand",7.88,"Art & Illustration,Music & Sound,Web & Interactive,Animation,Fullscreen,Horizontal Layout,Illustration,Storytelling,3D,WebGL,GSAP (Greensock),Three.js","Blue,Green,Yellow"
"https://www.awwwards.com/sites/nike-reactor","Month","Nike Reactor","The epic Nike Reactor let you experience how the new Nike React feel like. Get the world going and walk on feathers while bouncing on bubbles.","DPDK","Netherlands",8.17,"Promotional,Sports,Web & Interactive,Experimental,Animation,3D,CSS,WebGL,WebSockets,Node.js,GSAP Animation,Nginx,Three.js,React,Webpack","Blue,Green,White"
"https://www.awwwards.com/sites/design-canada","Month","Design Canada","Through the lens of graphic design, Design Canada follows the transformation of a nation from a colonial outpost to a vibrant and multicultural society.","Locomotive","Canada",7.84,"Culture & Education,Events,Promotional,Animation,Clean,Flexible,Typography,Storytelling,CSS3,HTML5,jQuery,WebGL,GSAP (Greensock),PHP,Three.js,Hammer.JS,Google Font API,Typekit","Black,Red,White"
"https://www.awwwards.com/sites/gallery-of-emerging-species","Month","Gallery of emerging species","In a world where 1 animal species disappears every 20 min, the concept of ""emerging species"" was a way to underline the incredible power of creation that Play-Doh offers.","Merci-Michel","France",7.95,"Games & Entertainment,Promotional,Web & Interactive,Colorful,Parallax,Gallery,3D,WebGL,GSAP (Greensock),PHP,Three.js","Red,Silver,White"
"https://www.awwwards.com/sites/couro-azul","Month","Couro Azul","Couro Azul is a strong player in the Automotive market. It also has a solid presence in the Railway and Aircraft markets.","Bürocratik","Portugal",8.02,"Business & Corporate,Promotional,Photography,Animation,Big Background Images,Clean,Typography,Video,Wordpress,CSS3,HTML5,jQuery,GSAP Animation,Apache,PHP,Snap.svg,Modernizr,PixiJS,Google Font API,FastClick,tween.js","Black,Brown,White"
"https://www.awwwards.com/sites/active-theory-v4","Month","Active Theory v4","The fourth iteration of our portfolio featuring latest work, experiments, and products.","Active Theory ","United States",8.2,"Design Agencies,Web & Interactive,Portfolio,Video,Transitions,3D,WebGL,Three.js,Google App Engine,GLSL","Black,Green,Pink"
"https://www.awwwards.com/sites/tao-tajima-filmmaker","Month","TAO TAJIMA | Filmmaker","A director and film maker with the Tokyo visual design studio Tangram.","homunculus Inc.","Japan",8.17,"Film & TV,Minimal,Portfolio,Video,Transitions,3D,Filters and Effects,CSS3,HTML5,WebGL,Apache,Three.js,GLSL,Modernizr,Typekit","Black,White"
"https://www.awwwards.com/sites/the-new-mobile-workforce-4","Month","The New Mobile Workforce","Race Day requires optimal performance. Take a look at how the Citrix team uses data to analyze, model, & design the car.","Immersive Garden","France",8.17,"Events,Sports,Technology,Experimental,Transitions,Sound-Audio,3D,CSS3,WebGL,Three.js","Black,Blue,Red"
"https://www.awwwards.com/sites/in-my-world","Month","In My World","In My World is a collaboration with photographer Robin Hammond. The website aims to raise awareness about the impact war, poverty and conflict can have on mental health issues.","Hello Monday ","United States",8.04,"Art & Illustration,Culture & Education,Photography,Transitions,Gallery,Storytelling,CSS3,HTML5,jQuery,GSAP (Greensock),PixiJS","Black,Silver,White"
"https://www.awwwards.com/sites/welcome-to-hogwarts","Month","Welcome to Hogwarts","To celebrate the first day of term at Hogwarts, Pottermore launched a fully interactive WebGL experience which gave users the chance to explore a 3D version of the school.","Active Theory ","United States",8.17,"Film & TV,Web & Interactive,Big Background Images,Fullscreen,Transitions,Storytelling,3D,Filters and Effects,jQuery,WebGL,Three.js,Varnish","Green,Pink,Silver"
"https://www.awwwards.com/sites/gleec-chat","Month","Gleec Chat","Explore Gleec Chat's experience to promote the application and discover all its secured functionalities.","Immersive Garden","France",8.01,"Mobile & Apps,Promotional,Technology,Scrolling,Unusual Navigation,Transitions,GSAP (Greensock),Nginx,Modernizr,Google Font API","Blue,Red,White"
"https://www.awwwards.com/sites/dunkirk-webvr","Month","Dunkirk WebVR","To promote the upcoming Warner Brothers' film, Dunkirk, we created a cooperative multi-player 360/WebVR experience allowing fans to escape the enemy and reenact the battle of Dunkirk.","Jam3","Canada",7.87,"Film & TV,Games & Entertainment,Promotional,360,VR,WebVR,Apache,PHP","Black"
"https://www.awwwards.com/sites/ouigo-let-s-play","Month","OUIGO - Let's play","Check out OUIGO Let's Play, a pinball game to promote the french low cost and high-speed train branch of the SNCF.","Merci-Michel / ROSAPARK","France",8.4,"Games & Entertainment,Other,Promotional,jQuery,WebGL,GSAP (Greensock),PHP,Google App Engine","Blue,Pink"
"https://www.awwwards.com/sites/we-the-fans","Month","We The Fans","""We The Fans"" is a multiplatform storytelling project about life and love as a football fan. We created a digital experience centered around the Chicago Bears' biggest fans.","Hello Monday ESPN ","United States",7.85,"Sports,CSS3,HTML5,jQuery,GSAP (Greensock),Modernizr,Zepto,Yepnope,Lo-dash","Black,Blue,Orange"
"https://www.awwwards.com/sites/mendo-book-store","Month","Mendo","A candy store for book aficionados","Build in Amsterdam","Netherlands",7.93,"E-Commerce,Animation,Parallax,Photography,Wordpress,jQuery,GSAP (Greensock),PHP,Nginx,Bootstrap,jQuery UI,Modernizr,Varnish","Black,White"
"https://www.awwwards.com/sites/a-world-with-no-heroes","Month","A World With No Heroes","Explore through 50 cameras the Bolivia of Ghost Recon WildlandsThe country has fallen into the hands of Santa Blanca Cartel who aims to create the biggest NarcoState in history","DDBParis / Make me pulse","France",8.22,"Games & Entertainment,Promotional,Web & Interactive,Experimental,Sound-Audio,3D,jQuery,WebGL,GSAP (Greensock)","Orange,Red,White"
"https://www.awwwards.com/sites/for-honor-scars","Month","For Honor - Scars","A scar on a weapon can say a lot about its owner's life. And death. Come discover the tale of the heroes of For Honor.","DDBParis","France",7.93,"Games & Entertainment,Web & Interactive,Experimental,Animation,Infinite Scroll,Sound-Audio,3D,jQuery,WebGL,Three.js,SoundManager","Black,Yellow"
"https://www.awwwards.com/sites/rainforest-foods-interactive-journey","Month","Rainforest Foods Experience","Discover a dreamy and interactive journey in the far away lands of Rainforest Foods.","Immersive Garden","France",7.79,"Food & Drink,Experimental,Big Background Images,Colorful,Fullscreen,Horizontal Layout,Storytelling,PHP,Nginx,PixiJS,Google Font API","Blue,Brown,Green"
"https://www.awwwards.com/sites/i-am-residente","Month","Residente","We collaborated with musical artist Residente to document his travels around the world. The site features an interactive map where we are all connected to each other.","Hello Monday ","United States",7.69,"Music & Sound,Video,Sound-Audio,HTML5,GSAP (Greensock),Apache,PHP,PixiJS","Black,Red"
"https://www.awwwards.com/sites/paper-planes","Month","Paper Planes","Catch and throw Paper Planes with one another around the world: a simple concept using the power of the web and Android to create an instant connection to one another. (Best on mobile)","Active Theory ","United States",7.68,"Culture & Education,Mobile & Apps,Web & Interactive,Animation,Colorful,3D,WebGL,WebSockets,Node.js,Three.js,Google App Engine,Express","Pink,Silver,White"
"https://www.awwwards.com/sites/discover-your-patronus","Month","Discover Your Patronus","The experience transports users into a 3D environment where those taking part will make a series of choices based on a set of cryptic prompts, eventually discovering their Patronus.","Active Theory ","United States",7.74,"Film & TV,Web & Interactive,Fullscreen,Unusual Navigation,Sound-Audio,3D,Filters and Effects,WebGL,Three.js,GLSL,Varnish,Facebook API,CreateJS","Black,Blue,White"
"https://www.awwwards.com/sites/kikk-festival2016","Month","KIKK Festival 2016","KIKK is an international festival of digital and creative cultures. Its interest lies in the artistic and economic implications of new technologies. The event gathers people of all backgrounds from all around the world.","Dogstudio","Belgium",8.11,"Art & Illustration,Culture & Education,Promotional,Animation,Colorful,WebGL","Pink,White"
"https://www.awwwards.com/sites/converse-diamonds","Month","Converse Diamonds","Wetropolis is a neon-tinged, future-soaked dystopia where it rains GIFs. The city's anthem is 'Diamonds' and its hero is Keith Ape. Follow him on a wet night out in his water-resistant Chuck II sneakers.","Resn","Netherlands",8.29,"Fashion,Music & Sound,Web & Interactive,Animation,Video,jQuery,WebGL,Underscore.js,Three.js,Backbone.js,RequireJS,Modernizr","Black"
"https://www.awwwards.com/sites/solarin","Month","Solarin","Epic, futuristic and luxurious, Sirin Labs proudly presents Solarin; their high performance smartphone with a military-grade secure zone. Discover tomorrow’s technology today through a spectacular 3D WebGL breakdown of the innovative features that make up the world’s most advanced phone.","MediaMonks","Netherlands",8.17,"Promotional,Technology,Web & Interactive,Big Background Images,Clean,Unusual Navigation,WebGL,GSAP Animation,RequireJS,Modernizr,Knockout","Black"
"https://www.awwwards.com/sites/resn-co-nz","Month","Resn","Resn. Infecting your screen for your enjoyment.","Resn","Netherlands",8.57,"Art & Illustration,Music & Sound,Web & Interactive,Animation,jQuery,WebGL,GSAP Animation,Underscore.js,Apache,PHP,Backbone.js,RequireJS,GLSL,Modernizr,Yepnope","Black,Silver,White"
"https://www.awwwards.com/sites/a-bear-s-eye-view-of-yellowstone","Month","A Bear's-Eye View of Yellowstone","This digital feature for National Geographic's May 2016 issue follows the journeys of 4 bears navigating the heart of Yellowstone National Park, as seen from the bears’ point of view.","Hello Monday ","United States",8.1,"Web & Interactive,Flexible,HTML5","Black,Brown,Yellow"
